{
  "version": 1,
  "categories": [
    {
      "id": "orchestration",
      "title": "协调层",
      "role": "non-worker",
      "default_stage": null,
      "default_target_path_policy": "not_applicable",
      "default_value_assessment": "retain",
      "default_invocation_mode": "direct"
    },
    {
      "id": "harness-infrastructure",
      "title": "Harness 基础设施层",
      "role": "worker",
      "default_stage": null,
      "default_target_path_policy": "coordinator_defined",
      "default_value_assessment": "situational",
      "default_invocation_mode": "internal_only"
    },
    {
      "id": "foundation-contracts",
      "title": "基础契约层",
      "role": "worker",
      "default_stage": "stage-0-contracts",
      "default_target_path_policy": "coordinator_defined",
      "default_value_assessment": "retain",
      "default_invocation_mode": "orchestrated"
    },
    {
      "id": "agent-core",
      "title": "Agent 核心层",
      "role": "worker",
      "default_stage": null,
      "default_target_path_policy": "coordinator_defined",
      "default_value_assessment": "retain",
      "default_invocation_mode": "orchestrated"
    },
    {
      "id": "capability-extensions",
      "title": "能力扩展层",
      "role": "worker",
      "default_stage": null,
      "default_target_path_policy": "coordinator_defined",
      "default_value_assessment": "retain",
      "default_invocation_mode": "orchestrated"
    },
    {
      "id": "production",
      "title": "生产化层",
      "role": "worker",
      "default_stage": "stage-7-production",
      "default_target_path_policy": "coordinator_defined",
      "default_value_assessment": "retain",
      "default_invocation_mode": "orchestrated"
    },
    {
      "id": "long-session",
      "title": "长会话扩展层",
      "role": "worker",
      "default_stage": "stage-3-long-session",
      "default_target_path_policy": "coordinator_defined",
      "default_value_assessment": "retain",
      "default_invocation_mode": "orchestrated"
    },
    {
      "id": "memory-extensions",
      "title": "记忆扩展层",
      "role": "worker",
      "default_stage": "stage-4-memory",
      "default_target_path_policy": "coordinator_defined",
      "default_value_assessment": "retain",
      "default_invocation_mode": "orchestrated"
    },
    {
      "id": "ide-input",
      "title": "IDE / 输入扩展层",
      "role": "worker",
      "default_stage": "stage-5-extensibility",
      "default_target_path_policy": "coordinator_defined",
      "default_value_assessment": "retain",
      "default_invocation_mode": "orchestrated"
    },
    {
      "id": "enterprise",
      "title": "企业 / 生产化扩展层",
      "role": "worker",
      "default_stage": "stage-8-enterprise",
      "default_target_path_policy": "coordinator_defined",
      "default_value_assessment": "retain",
      "default_invocation_mode": "orchestrated"
    },
    {
      "id": "methodology",
      "title": "方法论",
      "role": "worker",
      "default_stage": null,
      "default_target_path_policy": "coordinator_defined",
      "default_value_assessment": "situational",
      "default_invocation_mode": "direct"
    }
  ],
  "skills": [
    {
      "name": "agent-architecture-curriculum",
      "path": "skills/agent-architecture-curriculum",
      "category": "orchestration",
      "stage": null,
      "portability": "portable",
      "purpose": "课程化文档生成器，不作为设计/编码/审计 worker 使用",
      "best_for": null,
      "depends_on": [],
      "parallel_safe_with": [],
      "parallel_mode": "always",
      "needs_user_context": null,
      "user_invocable": true,
      "default_invocation_mode": "direct",
      "target_path_policy": "not_applicable",
      "value_assessment": "retain",
      "notes": []
    },
    {
      "name": "agent-loop",
      "path": "skills/agent-loop",
      "category": "agent-core",
      "stage": "stage-1-minimal-loop",
      "portability": "portable",
      "purpose": "循环状态机 + 退出条件 + 流式执行",
      "best_for": "构建主循环",
      "depends_on": [
        "unified-tool-interface"
      ],
      "parallel_safe_with": [
        "agent-memory"
      ],
      "parallel_mode": "contextual",
      "needs_user_context": "技术栈",
      "user_invocable": false,
      "default_invocation_mode": "orchestrated",
      "target_path_policy": "coordinator_defined",
      "value_assessment": "retain",
      "notes": [
        "默认通过 harness 调度，不建议用户直接调用。"
      ]
    },
    {
      "name": "agent-memory",
      "path": "skills/agent-memory",
      "category": "agent-core",
      "stage": "stage-4-memory",
      "portability": "cc-bound",
      "purpose": "4 类型记忆 + 双路径保存 + 过期检测",
      "best_for": "构建跨会话记忆",
      "depends_on": [
        "agent-loop"
      ],
      "parallel_safe_with": [
        "agent-reflection（仅设计阶段）"
      ],
      "parallel_mode": "contextual",
      "needs_user_context": "存储选型",
      "user_invocable": false,
      "default_invocation_mode": "orchestrated",
      "target_path_policy": "coordinator_defined",
      "value_assessment": "retain",
      "notes": [
        "默认通过 harness 调度，不建议用户直接调用。"
      ]
    },
    {
      "name": "agent-reflection",
      "path": "skills/agent-reflection",
      "category": "agent-core",
      "stage": "stage-4-memory",
      "portability": "cc-bound",
      "purpose": "纠正+确认学习 + auto-dream",
      "best_for": "构建自我改进机制",
      "depends_on": [
        "agent-memory"
      ],
      "parallel_safe_with": [
        "agent-memory（仅设计阶段）"
      ],
      "parallel_mode": "contextual",
      "needs_user_context": null,
      "user_invocable": false,
      "default_invocation_mode": "orchestrated",
      "target_path_policy": "coordinator_defined",
      "value_assessment": "retain",
      "notes": [
        "默认通过 harness 调度，不建议用户直接调用。"
      ]
    },
    {
      "name": "agent-resilience",
      "path": "skills/agent-resilience",
      "category": "agent-core",
      "stage": "stage-3-long-session",
      "portability": "cc-bound",
      "purpose": "Withhold + 5 级恢复 + 5 级压缩",
      "best_for": "构建错误恢复和长会话",
      "depends_on": [
        "agent-loop",
        "context-engineering"
      ],
      "parallel_safe_with": [],
      "parallel_mode": "always",
      "needs_user_context": null,
      "user_invocable": false,
      "default_invocation_mode": "orchestrated",
      "target_path_policy": "coordinator_defined",
      "value_assessment": "retain",
      "notes": [
        "默认通过 harness 调度，不建议用户直接调用。"
      ]
    },
    {
      "name": "agent-tool-budget",
      "path": "skills/agent-tool-budget",
      "category": "agent-core",
      "stage": "stage-2-security",
      "portability": "cc-bound",
      "purpose": "延迟加载 + 结果截断 + token 续跑",
      "best_for": "优化工具 token 消耗",
      "depends_on": [
        "unified-tool-interface"
      ],
      "parallel_safe_with": [
        "layered-permission"
      ],
      "parallel_mode": "always",
      "needs_user_context": null,
      "user_invocable": false,
      "default_invocation_mode": "orchestrated",
      "target_path_policy": "coordinator_defined",
      "value_assessment": "retain",
      "notes": [
        "默认通过 harness 调度，不建议用户直接调用。"
      ]
    },
    {
      "name": "api-client-layer",
      "path": "skills/api-client-layer",
      "category": "foundation-contracts",
      "stage": "stage-0-contracts",
      "portability": "portable",
      "purpose": "多 Provider API 客户端",
      "best_for": "构建 LLM 调用层",
      "depends_on": [],
      "parallel_safe_with": [
        "unified-tool-interface",
        "config-cascade"
      ],
      "parallel_mode": "always",
      "needs_user_context": "Provider 选型",
      "user_invocable": false,
      "default_invocation_mode": "orchestrated",
      "target_path_policy": "coordinator_defined",
      "value_assessment": "retain",
      "notes": [
        "默认通过 harness 调度，不建议用户直接调用。"
      ]
    },
    {
      "name": "architecture-invariants",
      "path": "skills/architecture-invariants",
      "category": "methodology",
      "stage": null,
      "portability": "cc-bound",
      "purpose": "6 条不变式 + 进化轨迹",
      "best_for": "架构评审/决策记录",
      "depends_on": [],
      "parallel_safe_with": [
        "eval-driven-design"
      ],
      "parallel_mode": "always",
      "needs_user_context": null,
      "user_invocable": true,
      "default_invocation_mode": "direct",
      "target_path_policy": "coordinator_defined",
      "value_assessment": "situational",
      "notes": [
        "专家直连入口：用于定向架构咨询，不替代 harness 的 state/trace 治理。"
      ]
    },
    {
      "name": "auth-identity",
      "path": "skills/auth-identity",
      "category": "foundation-contracts",
      "stage": "stage-0-contracts",
      "portability": "portable",
      "purpose": "认证 + 安全存储 + 多租户",
      "best_for": "构建认证系统",
      "depends_on": [],
      "parallel_safe_with": [
        "config-cascade"
      ],
      "parallel_mode": "always",
      "needs_user_context": "安全要求",
      "user_invocable": false,
      "default_invocation_mode": "orchestrated",
      "target_path_policy": "coordinator_defined",
      "value_assessment": "retain",
      "notes": [
        "默认通过 harness 调度，不建议用户直接调用。"
      ]
    },
    {
      "name": "command-sandbox",
      "path": "skills/command-sandbox",
      "category": "capability-extensions",
      "stage": "stage-2-security",
      "portability": "cc-bound",
      "purpose": "23 项 Bash 安全检查",
      "best_for": "构建命令执行安全层",
      "depends_on": [
        "layered-permission"
      ],
      "parallel_safe_with": [
        "agent-tool-budget"
      ],
      "parallel_mode": "always",
      "needs_user_context": null,
      "user_invocable": false,
      "default_invocation_mode": "orchestrated",
      "target_path_policy": "coordinator_defined",
      "value_assessment": "retain",
      "notes": [
        "默认通过 harness 调度，不建议用户直接调用。"
      ]
    },
    {
      "name": "compact-system",
      "path": "skills/compact-system",
      "category": "long-session",
      "stage": "stage-3-long-session",
      "portability": "portable",